{
    "$schema"  : "https://raw.githubusercontent.com/Jacob-C-Smith/G10-Schema/main/light-schema.json",
    "name"     : "Directional light",
    "type"     : "directional",
    "color"    : [ 1, 1, 1 ],
    "location" : [ 1, 1, 1 ],
    "intensity": 60,
    "falloff"  : 2,
    "direction": [ 0, 0, -1 ]
}